{
  "id": "compacted-clay-lawn",
  "name": "Compacted Clay Lawn (Pre-Rewilding)",
  "phRange": { "min": 5.5, "max": 6.5 },
  "organicMatterTarget": 5,
  "compaction": "high",
  "amendments": ["core aeration", "compost topdressing", "gypsum (if sodic)"],
  "notes": "Typical starting condition for suburban SE lawns being converted to native habitat.",
  "version": "1.0.0",
  "updated": "2026-07-12"
}
